{
    "$schema": "http://json-schema.org/draft-07/schema#",
    "title": "Basic Passport for a natural person",
    "type": "object",
    "properties": {
        "@context": {
            "type": "array",
            "items": {
                "type": "string"
            }
        },
        "credentialSchema": {
            "type": "object",
            "properties": {
                "id": {
                    "type": "string"
                },
                "type": {
                    "type": "string"
                }
            },
            "additionalProperties": false
        },
        "credentialStatus": {
            "type": "object",
            "properties": {
                "id": {
                    "type": "string"
                },
                "type": {
                    "type": "string"
                }
            },
            "additionalProperties": false
        },
        "credentialSubject": { "$ref": "#/definitions/UniversityTranscript" },
        "evidence": {
            "type": "array",
            "items": {
                "type": "object",
                "properties": {
                    "documentPresence": {
                        "type": "array",
                        "items": {
                            "type": "string"
                        }
                    },
                    "evidenceDocument": {
                        "type": "array",
                        "items": {
                            "type": "string"
                        }
                    },
                    "id": {
                        "type": "string"
                    },
                    "subjectPresence": {
                        "type": "string"
                    },
                    "type": {
                        "type": "array",
                        "items": {
                            "type": "string"
                        }
                    },
                    "verifier": {
                        "type": "string"
                    }
                },
                "additionalProperties": false
            }
        },
        "expirationDate": {
            "type": "string"
        },
        "id": {
            "type": "string"
        },
        "issuanceDate": {
            "type": "string"
        },
        "issued": {
            "type": "string"
        },
        "issuer": {
            "type": "string"
        },
        "proof": {
            "type": "object",
            "properties": {
                "created": {
                    "type": "string"
                },
                "creator": {
                    "type": "string"
                },
                "domain": {
                    "type": "string"
                },
                "jws": {
                    "type": "string"
                },
                "nonce": {
                    "type": "string"
                },
                "proofPurpose": {
                    "type": "string"
                },
                "type": {
                    "type": "string"
                },
                "verificationMethod": {
                    "type": "string"
                }
            },
            "additionalProperties": false
        },
        "type": {
            "type": "array",
            "items": {
                "type": "string"
            }
        },
        "validFrom": {
            "type": "string"
        }
    },
    "required": [
        "@context",
        "type"
    ],
    "additionalProperties": false,

    "definitions": {
        "UniversityTranscript": {
            "type": "object",
            "additionalProperties": false,
            "properties": {
                "id": {
                    "type": "string"
                },
                "givenName": {
                    "type": "string"
                },
                "familyName": {
                    "type": "string"
                },
                "ssn": {
                    "type": "string"
                },
                "degree": {
                    "type": "string"
                },
                "status": {
                    "type": "string"
                },
                "year": {
                    "type": "string",
                    "format": "integer"
                },
                "average": {
                    "type": "string",
                    "format": "integer"
                }
            },
            "required": [
                "average",
                "degree",
                "familyName",
                "givenName",
                "id",
                "ssn",
                "status",
                "year"
            ],
            "title": "UniversityTranscript"
        }
    }
}
