{
  "@context": [
    "https://www.w3.org/2018/credentials/v1"
  ],
  "type": [
    "VerifiableCredential",
    "UniversityTranscript"
  ],
  "credentialSchema": {
    "id": "class:nessus/schema/UniversityTranscriptSchema-draft-01.json",
    "type": "JsonSchemaValidator2018"
  },
  "id": "urn:uuid:3add94f4-28ec-42a1-8704-4e4aa51006b4",
  "issuer": "did:ebsi:2A9BZ9SUe6BatacSpvs1V5CdjHvLpQ7bEsi2Jb6LdHKnQxaN",
  "issuanceDate": "2021-08-31T00:00:00Z",
  "expirationDate": "2031-08-31T00:00:00Z",
  "credentialSubject": {
    "id": "did:example:BcRisGnqV4QPb6bRmDCqEjyuubBarS1Y1nhDwxBMTXY4",
    "givenName": "Alice",
    "familyName": "Garcia",
    "ssn": "123-45-6789",
    "degree": "Bachelor of Science, Marketing",
    "status": "graduated",
    "year": "2015",
    "average": "5"
  }
}